{
  "schema_version": "grading-agent-v2",
  "request_id": "subjective-grade-image-0001",
  "status": "candidate_mapping",
  "delivery": "teacher_suggestion",
  "criterion_candidates": [
    {"rubric_point_id": "p1", "status": "supported", "evidence_ids": ["s1", "f1"], "confidence": 0.91, "reason_code": "semantic_alignment"},
    {"rubric_point_id": "p2", "status": "supported", "evidence_ids": ["s2", "f2"], "confidence": 0.93, "reason_code": "semantic_alignment"}
  ],
  "alternative_solution_candidate": false,
  "risk_flags": ["human_review_required"],
  "needs_human_review": true,
  "model_version": "fixture-multimodal-model-v1",
  "prompt_version": "subjective-image-contract-v2",
  "rubric_version": "rubric-v4",
  "capability_profile": "internal-image-contract-v2",
  "mock": false,
  "telemetry": {"adapter": "fixture_only", "provider": "offline", "deployment": "unreachable", "region": "none", "attempts": 1, "repair_attempted": false, "prior_error_codes": [], "elapsed_ms": 1}
}
